train,stations
train_1,"[Dordrecht, Rotterdam Centraal, Rotterdam Alexander, Rotterdam Blaak, Schiedam Centrum, Delft, Den Haag HS, Leiden Centraal, Schiphol Airport, Amsterdam Zuid, Amsterdam Amstel, Hilversum, Almere Centrum, Lelystad Centrum]"
train_1,"[Zwolle, Steenwijk, Heerenveen, Leeuwarden, Groningen, Assen]"
train_1,"[Amsterdam Amstel, Amsterdam Centraal, Amsterdam Sloterdijk, Haarlem, Beverwijk, Castricum, Zaandam, Hoorn, Alkmaar, Den Helder]"
train_1,"[Nijmegen, Oss, s-Hertogenbosch, Tilburg, Breda, Etten-Leur, Roosendaal, Vlissingen]"
train_1,"[Maastricht, Sittard, Roermond, Weert, Eindhoven, Helmond, Venlo]"
train_1,"[Almelo, Hengelo, Enschede]"
train_1,"[Den Haag HS, Leiden Centraal, Alphen a/d Rijn, Utrecht Centraal, Amersfoort, Apeldoorn, Deventer, Zutphen, Dieren, Arnhem Centraal, Ede-Wageningen]"
train_1,"[Heemstede-Aerdenhout, Leiden Centraal, Den Haag Laan v NOI, Delft, Den Haag HS, Gouda, Den Haag Centraal]"
score,8129.065573770491
