train,stations
train_1,"[Hilversum, Almere Centrum, Lelystad Centrum]"
train_1,"[Vlissingen, Roosendaal, Etten-Leur, Breda, Dordrecht, Rotterdam Centraal, Rotterdam Alexander, Rotterdam Blaak, Schiedam Centrum, Delft, Den Haag Centraal]"
train_1,"[Zwolle, Steenwijk, Heerenveen, Leeuwarden, Groningen, Assen]"
train_1,"[Castricum, Zaandam, Beverwijk, Haarlem, Heemstede-Aerdenhout, Leiden Centraal, Alphen a/d Rijn, Gouda, Den Haag Laan v NOI, Delft, Den Haag HS]"
train_1,"[Maastricht, Sittard, Roermond, Weert, Eindhoven, Helmond, Venlo]"
train_1,"[Ede-Wageningen, Utrecht Centraal, Amersfoort, Apeldoorn, Deventer, Almelo, Hengelo, Enschede]"
train_1,"[Schiphol Airport, Amsterdam Zuid, Amsterdam Amstel, Amsterdam Centraal, Amsterdam Sloterdijk, Zaandam, Hoorn, Alkmaar, Den Helder]"
train_1,"[Zutphen, Dieren, Arnhem Centraal, Nijmegen, Oss, s-Hertogenbosch, Tilburg, Eindhoven, Weert, Roermond, Sittard, Heerlen]"
score,8246.0
