train,stations
train_1,"[Haarlem, Heemstede-Aerdenhout, Leiden Centraal, Alphen a/d Rijn, Utrecht Centraal, Hilversum, Almere Centrum, Lelystad Centrum]"
train_1,"[Utrecht Centraal, Amsterdam Amstel, Amsterdam Centraal, Amsterdam Sloterdijk, Amsterdam Zuid, Schiphol Airport, Leiden Centraal, Alphen a/d Rijn, Gouda, Den Haag HS, Delft, Den Haag Laan v NOI]"
train_1,"[Heerlen, Sittard, Roermond, Weert, Eindhoven, Helmond, Venlo]"
train_1,"[Nijmegen, Oss, s-Hertogenbosch, Tilburg, Eindhoven, Weert, Roermond, Sittard, Maastricht]"
train_1,"[Hoorn, Zaandam, Beverwijk, Castricum, Alkmaar, Den Helder]"
train_1,"[Leeuwarden, Heerenveen, Steenwijk, Zwolle, Almelo, Hengelo, Enschede]"
train_1,"[Groningen, Assen, Zwolle, Amersfoort, Apeldoorn, Deventer, Zutphen, Dieren, Arnhem Centraal, Ede-Wageningen]"
train_1,"[Den Haag Centraal, Delft, Schiedam Centrum, Rotterdam Centraal, Rotterdam Alexander, Rotterdam Blaak, Dordrecht, Breda, Etten-Leur, Roosendaal, Vlissingen]"
score,8171.0
